[
  {
    "schema_version": "1.0.0",
    "episode_id": "ginfer-sm89-muse-c7-c11-judgment",
    "family_id": "family-sm89-muse-c7-three-stage-down",
    "task_view": "judgment",
    "scope": {
      "repository": "GInfer",
      "target": "muse-glimmer-30b/groupwise-int-dflash-q4",
      "boundary": "public Q4 Op followed by Muse Program round",
      "op_family": "q4_linear",
      "architectures": ["sm_89"],
      "hardware_skus": ["NVIDIA GeForce RTX 4090"],
      "workload": {"mode": "DFlash2", "draft_width": 4, "kv": "INT8-G64", "capacity": 131072, "concurrency": 8, "resident_tokens_per_request": 8192}
    },
    "provenance": {
      "source_ids": ["ginfer-sm89-muse-cycle7-closed-ledger", "ginfer-sm89-candidate-history"],
      "snapshot_refs": ["latest:ginfer-sm89-muse-cycle7-closed-ledger", "latest:ginfer-sm89-candidate-history"],
      "license_status": "internal",
      "evidence_cutoff": "2026-08-21T02:20:00-05:00"
    },
    "split_group": {
      "group_id": "sm89-muse-c7-q4-down-three-stage",
      "lineage_id": "32f859076072df8fbc2c58af78de4e537302057d+d4a5041335c199510cf54b0483ba7dcec8e52994",
      "campaign_id": "sm89-muse-20260821",
      "mechanism_cluster": "q4-three-stage-down-projection",
      "assigned_split": "train",
      "evaluation_tier": "train"
    },
    "events": [
      {"event_id": "e000", "sequence": 0, "actor": "system", "event_type": "instruction", "information_class": "task_context", "payload": "Judge by the independent oracle, complete public-Op matrix, and repeated real Program boundary. A local Op speedup is not sufficient.", "evidence_refs": ["ginfer-runbook-kernel-campaign-36bbd955#gate-order"]},
      {"event_id": "e001", "sequence": 1, "actor": "assistant", "event_type": "patch", "information_class": "candidate_artifact", "payload": "Candidate 32f85907 uses a three-stage Q4 down-projection pipeline; it was committed before remote execution.", "evidence_refs": ["ginfer-sm89-candidate-history#32f859076072df8fbc2c58af78de4e537302057d"]},
      {"event_id": "e002", "sequence": 2, "actor": "tool", "event_type": "validation", "information_class": "post_candidate_result", "payload": "Independent oracle passed.", "evidence_refs": ["ginfer-sm89-muse-cycle7-closed-ledger#candidate-11"]},
      {"event_id": "e003", "sequence": 3, "actor": "tool", "event_type": "measurement", "information_class": "post_candidate_result", "payload": "Public T40 improved from the cycle baseline to 359.264 us (-6.94%), but repeated C8 Program rounds were 76.5350 and 76.5768 ms versus 76.9016 ms (-0.48% and -0.42%).", "evidence_refs": ["ginfer-sm89-muse-cycle7-closed-ledger#candidate-11"], "measurements": [{"name": "q4_down_t40_delta", "value": -6.94, "unit": "percent", "direction": "lower_is_better", "fact_class": "device_measured", "workload_key": "q4-down-t40", "hardware_key": "rtx4090-sm89", "toolchain_key": "cuda13.3"}, {"name": "program_c8_rep1_delta", "value": -0.48, "unit": "percent", "direction": "lower_is_better", "fact_class": "device_measured", "workload_key": "muse-dflash2-c8-8k", "hardware_key": "rtx4090-sm89", "toolchain_key": "cuda13.3"}]},
      {"event_id": "e004", "sequence": 4, "actor": "assistant", "event_type": "decision", "information_class": "disposition_label", "payload": "Reject. Correctness passed and the Op point improved, but both real-boundary repetitions are far below the 2% campaign gate. Preserve the evidence and restore the accepted source.", "evidence_refs": ["ginfer-sm89-muse-cycle7-closed-ledger#candidate-11"]},
      {"event_id": "e005", "sequence": 5, "actor": "tool", "event_type": "restoration", "information_class": "restoration", "payload": "Restored by commit d4a5041335c199510cf54b0483ba7dcec8e52994.", "evidence_refs": ["ginfer-sm89-candidate-history#d4a5041335c199510cf54b0483ba7dcec8e52994"]}
    ],
    "view": {"candidate_generation": false, "input_event_ids": ["e000", "e001", "e002", "e003"], "target_event_ids": ["e004"], "withheld_event_ids": ["e004", "e005"], "result_label_visible": false},
    "outcome": {"disposition": "rejected", "candidate_commit": "32f859076072df8fbc2c58af78de4e537302057d", "restoration_commit": "d4a5041335c199510cf54b0483ba7dcec8e52994", "correctness": "passed", "performance_claim": "Op -6.94%; Program only -0.48%/-0.42%, below the 2% real-boundary gate.", "limitations": []},
    "preference": {"chosen_event_ids": ["e004"], "rejected_response": "Accept the candidate because the public T40 point improved 6.94%; the operator result proves the optimization is successful.", "failure_mode": "microbenchmark_overclaim"},
    "quality": {"review_status": "seed_reviewed", "hard_negative": true, "contains_hidden_chain_of_thought": false, "secret_scan": "not_run", "dedup_key": "sm89|muse|q4|three-stage-down|real-boundary-miss", "notes": ["Real committed candidate and restoration pair."]}
  },
  {
    "schema_version": "1.0.0",
    "episode_id": "ginfer-sm89-muse-c7-c20-implementation",
    "family_id": "family-sm89-muse-c7-two-group-n19968",
    "task_view": "implementation",
    "scope": {
      "repository": "GInfer",
      "target": "muse-glimmer-30b/groupwise-int-dflash-q4",
      "boundary": "Q4 Linear N19968 T40 and Muse Program round",
      "op_family": "q4_linear",
      "architectures": ["sm_89"],
      "hardware_skus": ["NVIDIA GeForce RTX 4090"],
      "workload": {"mode": "DFlash2", "draft_width": 4, "kv": "INT8-G64", "concurrency": 8}
    },
    "provenance": {
      "source_ids": ["ginfer-sm89-muse-cycle7-closed-ledger", "ginfer-sm89-candidate-history"],
      "snapshot_refs": ["latest:ginfer-sm89-muse-cycle7-closed-ledger", "latest:ginfer-sm89-candidate-history"],
      "license_status": "internal",
      "evidence_cutoff": "2026-08-21T02:19:59-05:00"
    },
    "split_group": {
      "group_id": "sm89-muse-c7-q4-n19968-bk128",
      "lineage_id": "21310f21d6287b7ea5a1347f1841b544162d2f7c",
      "campaign_id": "sm89-muse-20260821",
      "mechanism_cluster": "q4-two-complete-groups-per-k-tile",
      "assigned_split": "validation",
      "evaluation_tier": "in_arch"
    },
    "events": [
      {"event_id": "e000", "sequence": 0, "actor": "user", "event_type": "instruction", "information_class": "task_context", "payload": "Implement one SM89-specific candidate for the dominant Muse Q4 N19968/T40 route. Preserve the Q4-G64 contract, non-T40 seams, and non-SM89 builds.", "evidence_refs": ["ginfer-runbook-kernel-campaign-36bbd955#candidate-accounting"]},
      {"event_id": "e001", "sequence": 1, "actor": "tool", "event_type": "observation", "information_class": "pre_candidate_evidence", "payload": "The post-cycle-6 profile attributes 47.577 ms per round to Q4 N19968 R64C48, the largest kernel class. The current K tile stages one 64-element quantization group.", "evidence_refs": ["ginfer-sm89-muse-cycle7-closed-ledger#profile"]},
      {"event_id": "e002", "sequence": 2, "actor": "assistant", "event_type": "technical_rationale", "information_class": "candidate_artifact", "payload": "Try a T40- and N19968-exact SM89 schedule with BK128. Staging two complete Q4-G64 groups per K tile can halve pipeline/barrier iterations. Reject if the oracle fails, T39/T41 move, or the Program boundary does not clear its gate.", "evidence_refs": ["ginfer-sm89-candidate-history#21310f21d6287b7ea5a1347f1841b544162d2f7c"]},
      {"event_id": "e003", "sequence": 3, "actor": "assistant", "event_type": "patch", "information_class": "candidate_artifact", "payload": "Relax the schedule assertion from block-K equal to one quant group to block-K divisible by the quant group; add an R64C40 BK128 schedule and dispatch it only for sm_89, T==40, N==19968, with an explicit unsupported fallback elsewhere.", "evidence_refs": ["ginfer-sm89-candidate-history#21310f21d6287b7ea5a1347f1841b544162d2f7c"]},
      {"event_id": "e004", "sequence": 4, "actor": "tool", "event_type": "validation", "information_class": "post_candidate_result", "payload": "Independent oracle passed; T39/T41 seams were neutral.", "evidence_refs": ["ginfer-sm89-muse-cycle7-closed-ledger#candidate-20"]},
      {"event_id": "e005", "sequence": 5, "actor": "tool", "event_type": "measurement", "information_class": "post_candidate_result", "payload": "T40 fell from 305.152 to 210.944 us (-30.87%); repeated C8 Program rounds improved -17.46% and -17.55%, with C1 -0.19% and C4 +0.60%.", "evidence_refs": ["ginfer-sm89-muse-cycle7-closed-ledger#candidate-20"], "measurements": [{"name": "q4_n19968_t40_delta", "value": -30.87, "unit": "percent", "direction": "lower_is_better", "fact_class": "device_measured", "workload_key": "q4-n19968-k6656-t40", "hardware_key": "rtx4090-sm89", "toolchain_key": "cuda13.3"}, {"name": "muse_program_c8_rep1_delta", "value": -17.46, "unit": "percent", "direction": "lower_is_better", "fact_class": "device_measured", "workload_key": "muse-dflash2-c8-8k", "hardware_key": "rtx4090-sm89", "toolchain_key": "cuda13.3"}]},
      {"event_id": "e006", "sequence": 6, "actor": "assistant", "event_type": "decision", "information_class": "disposition_label", "payload": "Accept after the real-boundary, seam, Engine-sentinel, and registered-real-test gates pass.", "evidence_refs": ["ginfer-sm89-muse-cycle7-closed-ledger#accepted-sentinels"]}
    ],
    "view": {"candidate_generation": true, "input_event_ids": ["e000", "e001"], "target_event_ids": ["e002", "e003"], "withheld_event_ids": ["e004", "e005", "e006"], "result_label_visible": false},
    "outcome": {"disposition": "accepted", "candidate_commit": "21310f21d6287b7ea5a1347f1841b544162d2f7c", "restoration_commit": null, "correctness": "passed", "performance_claim": "T40 -30.87%; repeated C8 Program -17.46%/-17.55% with seams neutral.", "limitations": ["Measured on the campaign RTX 4090 only."]},